{
  "schema_version": "1.0.0",
  "run_id": "20261016T010000Z",
  "seat": "gmail",
  "source": "gmail",
  "account": "gmail",
  "status": "BLOCKED-CONNECTOR",
  "started_at": "2026-10-16T01:00:00Z",
  "finished_at": "2026-10-16T01:20:00Z",
  "attempts": 1,
  "counts": {
    "before": {
      "unread": null
    },
    "after": {
      "unread": null
    },
    "processed": 0,
    "important": 0,
    "bulk": 0
  },
  "items": [],
  "drafts": [],
  "owner_decisions": [],
  "mutations": [],
  "errors": [
    {
      "at": "2026-10-16T01:20:00Z",
      "attempt": 1,
      "step": "probe",
      "message": "example failure"
    }
  ],
  "tab_closed": true
}
